{
  "$schema": "https://json-schema.org/draft/2020-12/schema",
  "$id": "https://github.com/hvitiswift-afk/nextjs-boilerplate/schemas/revenue/fardarter-drive-consent-attestation-v6-7.schema.json",
  "title": "Fardarter Drive Consent Attestation v6.7",
  "type": "object",
  "additionalProperties": false,
  "required": ["schemaVersion","attestationId","driveId","controllerVersion","controllingIssue","source","package","evidenceChecklist","review","publicSafeAttestation","nextCandidate","actualEffects","generatedAt","attestationReceiptDigest"],
  "properties": {
    "schemaVersion":{"const":"1.0.0"},
    "attestationId":{"const":"FARDARTER-CONSENT-ATTESTATION-ISSUE-159-V6-7"},
    "driveId":{"const":"FARDARTER-DRIVE-V6"},
    "controllerVersion":{"const":"6.7.0"},
    "controllingIssue":{"const":180},
    "source":{"type":"object","additionalProperties":false,"required":["entityIssue","currentCanonicalState","targetCanonicalState","requiredGate","eventHeadSequence","eventHeadDigest","reconciliationSequence","reconciliationDigest"],"properties":{"entityIssue":{"const":159},"currentCanonicalState":{"const":"SCOPE_DRAFTED"},"targetCanonicalState":{"const":"HUMAN_ACCEPTED"},"requiredGate":{"const":"HUMAN_APPROVAL_AND_BUYER_CONSENT"},"eventHeadSequence":{"const":1},"eventHeadDigest":{"const":"3859eac9c63bef83624111704d38cf217b0c1a4ece6df874e72a76e9fb1ffc3b"},"reconciliationSequence":{"const":1},"reconciliationDigest":{"const":"9f4f878cc0f8f2ddfa7bbdb594d2b9164064acd8901301404aed57b4065eca0f"}}},
    "package":{"type":"object","additionalProperties":false,"required":["state","privatePackageIdPresent","privatePackageIdPublic","privateLocationPublic","evidenceContentsPublic","identityPublic","signaturePublic","reviewerIdentityPublic"],"properties":{"state":{"const":"NO_PACKAGE"},"privatePackageIdPresent":{"const":false},"privatePackageIdPublic":{"const":false},"privateLocationPublic":{"const":false},"evidenceContentsPublic":{"const":false},"identityPublic":{"const":false},"signaturePublic":{"const":false},"reviewerIdentityPublic":{"const":false}}},
    "evidenceChecklist":{"type":"array","minItems":10,"maxItems":10,"items":{"type":"object","additionalProperties":false,"required":["evidenceId","state"],"properties":{"evidenceId":{"type":"string","minLength":5},"state":{"enum":["MISSING","NOT_PERFORMED","NOT_ESTABLISHED","VERIFIED"]}}}},
    "review":{"type":"object","additionalProperties":false,"required":["state","independentReviewerAssigned","independentVerificationPerformed","allRequiredEvidenceVerified","revocationClear","expiryValid","eligibleForHumanApplicationReview","decision"],"properties":{"state":{"const":"NOT_READY"},"independentReviewerAssigned":{"const":false},"independentVerificationPerformed":{"const":false},"allRequiredEvidenceVerified":{"const":false},"revocationClear":{"const":false},"expiryValid":{"const":false},"eligibleForHumanApplicationReview":{"const":false},"decision":{"const":"AWAITING_COUNTERPARTY_EVIDENCE"}}},
    "publicSafeAttestation":{"type":"object","additionalProperties":false,"required":["metadataOnly","identityExcluded","signatureExcluded","privateFileIdsExcluded","evidenceContentsExcluded","digestAloneProvesConsent","attestationDigest"],"properties":{"metadataOnly":{"const":true},"identityExcluded":{"const":true},"signatureExcluded":{"const":true},"privateFileIdsExcluded":{"const":true},"evidenceContentsExcluded":{"const":true},"digestAloneProvesConsent":{"const":false},"attestationDigest":{"const":"0026a05117e349524c51e7000adffc773c5be4986149c4636c111306b8dbe7e8"}}},
    "nextCandidate":{"type":"object","additionalProperties":false,"required":["eventSequence","previousEventDigest","reconciliationSequence","previousSnapshotDigest","canonical","applied"],"properties":{"eventSequence":{"const":2},"previousEventDigest":{"const":"3859eac9c63bef83624111704d38cf217b0c1a4ece6df874e72a76e9fb1ffc3b"},"reconciliationSequence":{"const":2},"previousSnapshotDigest":{"const":"9f4f878cc0f8f2ddfa7bbdb594d2b9164064acd8901301404aed57b4065eca0f"},"canonical":{"const":false},"applied":{"const":false}}},
    "actualEffects":{"type":"object","additionalProperties":false,"required":["canonicalEventAppended","humanAcceptedCreated","customerCreated","orderCreated","contractAccepted","paymentObligationCreated","paymentProved","paidWorkStarted","activeCapacityUsed","capacityCeilingChanged","legalTermsSelected","indemnityResultCreated"],"properties":{"canonicalEventAppended":{"const":false},"humanAcceptedCreated":{"const":false},"customerCreated":{"const":false},"orderCreated":{"const":false},"contractAccepted":{"const":false},"paymentObligationCreated":{"const":false},"paymentProved":{"const":false},"paidWorkStarted":{"const":false},"activeCapacityUsed":{"const":false},"capacityCeilingChanged":{"const":false},"legalTermsSelected":{"const":false},"indemnityResultCreated":{"const":false}}},
    "generatedAt":{"type":"string","format":"date-time"},
    "attestationReceiptDigest":{"const":"27c8fb452b3b7112d9f714449a232b9416e66718677b8595c0a0eda438078a7d"}
  }
}
