{
  "schemaVersion": "1.0.0",
  "attestationId": "FARDARTER-CONSENT-ATTESTATION-ISSUE-159-V6-7",
  "driveId": "FARDARTER-DRIVE-V6",
  "controllerVersion": "6.7.0",
  "controllingIssue": 180,
  "source": {
    "entityIssue": 159,
    "currentCanonicalState": "SCOPE_DRAFTED",
    "targetCanonicalState": "HUMAN_ACCEPTED",
    "requiredGate": "HUMAN_APPROVAL_AND_BUYER_CONSENT",
    "eventHeadSequence": 1,
    "eventHeadDigest": "3859eac9c63bef83624111704d38cf217b0c1a4ece6df874e72a76e9fb1ffc3b",
    "reconciliationSequence": 1,
    "reconciliationDigest": "9f4f878cc0f8f2ddfa7bbdb594d2b9164064acd8901301404aed57b4065eca0f"
  },
  "package": {
    "state": "NO_PACKAGE",
    "privatePackageIdPresent": false,
    "privatePackageIdPublic": false,
    "privateLocationPublic": false,
    "evidenceContentsPublic": false,
    "identityPublic": false,
    "signaturePublic": false,
    "reviewerIdentityPublic": false
  },
  "evidenceChecklist": [
    {"evidenceId":"COUNTERPARTY_IDENTITY","state":"MISSING"},
    {"evidenceId":"AUTHORITY_AND_CAPACITY_TO_CONSENT","state":"MISSING"},
    {"evidenceId":"EXACT_SCOPE_PRESENTED","state":"MISSING"},
    {"evidenceId":"AFFIRMATIVE_CONSENT_TO_EXACT_SCOPE","state":"MISSING"},
    {"evidenceId":"CONSENT_TIMESTAMP_AND_CHANNEL","state":"MISSING"},
    {"evidenceId":"AUTHENTICATION_OR_SIGNATURE_EVIDENCE","state":"MISSING"},
    {"evidenceId":"REVOCATION_AND_CONTRADICTION_CHECK","state":"NOT_PERFORMED"},
    {"evidenceId":"EXPIRY_VALIDITY","state":"NOT_ESTABLISHED"},
    {"evidenceId":"SOURCE_ENTITY_LINKAGE","state":"VERIFIED"},
    {"evidenceId":"INDEPENDENT_REVIEWER_ATTESTATION","state":"MISSING"}
  ],
  "review": {
    "state": "NOT_READY",
    "independentReviewerAssigned": false,
    "independentVerificationPerformed": false,
    "allRequiredEvidenceVerified": false,
    "revocationClear": false,
    "expiryValid": false,
    "eligibleForHumanApplicationReview": false,
    "decision": "AWAITING_COUNTERPARTY_EVIDENCE"
  },
  "publicSafeAttestation": {
    "metadataOnly": true,
    "identityExcluded": true,
    "signatureExcluded": true,
    "privateFileIdsExcluded": true,
    "evidenceContentsExcluded": true,
    "digestAloneProvesConsent": false,
    "attestationDigest": "0026a05117e349524c51e7000adffc773c5be4986149c4636c111306b8dbe7e8"
  },
  "nextCandidate": {
    "eventSequence": 2,
    "previousEventDigest": "3859eac9c63bef83624111704d38cf217b0c1a4ece6df874e72a76e9fb1ffc3b",
    "reconciliationSequence": 2,
    "previousSnapshotDigest": "9f4f878cc0f8f2ddfa7bbdb594d2b9164064acd8901301404aed57b4065eca0f",
    "canonical": false,
    "applied": false
  },
  "actualEffects": {
    "canonicalEventAppended": false,
    "humanAcceptedCreated": false,
    "customerCreated": false,
    "orderCreated": false,
    "contractAccepted": false,
    "paymentObligationCreated": false,
    "paymentProved": false,
    "paidWorkStarted": false,
    "activeCapacityUsed": false,
    "capacityCeilingChanged": false,
    "legalTermsSelected": false,
    "indemnityResultCreated": false
  },
  "generatedAt": "2026-07-30T11:35:00Z",
  "attestationReceiptDigest": "27c8fb452b3b7112d9f714449a232b9416e66718677b8595c0a0eda438078a7d"
}
